{
  "schema_version": 1,
  "id": "security-baseline",
  "description": "Supported install starts from the Linura fail-closed security posture.",
  "requires": [
    "linura-os-image"
  ],
  "steps": [
    {
      "name": "inbound-firewall-default-deny",
      "command": "nft list ruleset | grep -Eq 'hook input.*policy (drop|reject)|policy (drop|reject)'"
    },
    {
      "name": "ssh-service-not-enabled",
      "command": "for unit in ssh.service sshd.service ssh.socket sshd.socket; do ! systemctl is-enabled \"$unit\" >/dev/null 2>&1 || exit 1; done"
    },
    {
      "name": "untrusted-package-sources-disabled",
      "command": "! grep -R -Eiq 'trusted=yes|allow-insecure=yes|allow-weak=yes|allow_downgrade_to_insecure_repositories' /etc/apt/sources.list /etc/apt/sources.list.d 2>/dev/null"
    },
    {
      "name": "security-policy-present",
      "command": "test -f /etc/linura/install-policy.json && test \"$(stat -c %U:%G:%a /etc/linura/install-policy.json)\" = root:root:600"
    }
  ],
  "execution_status": "executable"
}
