{
  "schema_version": 1,
  "id": "firstboot-offline",
  "description": "v0.9 First Boot remains usable without a model provider or network namespace and reports the exact bounded QualificationEnvironment with lifecycle status derived from the exact-source build version.",
  "requires": [
    "linura-firstboot",
    "linuractl",
    "linura-authorityd"
  ],
  "steps": [
    {
      "name": "verify-qualification-architecture",
      "command": "test \"$(uname -m)\" = x86_64"
    },
    {
      "name": "verify-qualification-distribution",
      "command": "grep -Eq '^ID=ubuntu$' /etc/os-release && grep -Eq '^VERSION_ID=\"?24\\.04\"?$' /etc/os-release"
    },
    {
      "name": "verify-qualification-virtualization",
      "command": "test \"$(systemd-detect-virt)\" = qemu"
    },
    {
      "name": "verify-systemd",
      "command": "test -d /run/systemd/system && systemctl --version >/dev/null"
    },
    {
      "name": "verify-cli",
      "command": "linuractl version"
    },
    {
      "name": "verify-firstboot-qualification-environment",
      "command": "version=$(linuractl version | awk '{print $2}'); if [ \"$version\" = 0.9.0 ]; then expected_status=release-qualified-experimental; else expected_status=candidate-not-yet-release-supported; fi; output=$(linura-firstboot --qualification-environment); printf '%s\\n' \"$output\" | grep -Fx 'id=qualification/ubuntu-24.04-lts/amd64/qemu-tcg-headless' && printf '%s\\n' \"$output\" | grep -Fx 'base_image_sha256=d1940f7d69d343355e183dff1e08a59852d32e7309baa7a4bad8365b11b005ac' && printf '%s\\n' \"$output\" | grep -Fx 'kind=qualification-environment' && printf '%s\\n' \"$output\" | grep -Fx \"status=$expected_status\""
    },
    {
      "name": "verify-firstboot-without-network",
      "command": "sudo -n unshare --net -- /usr/local/bin/linura-firstboot --self-check"
    },
    {
      "name": "verify-production-authority-fails-closed-on-invalid-state-dir",
      "command": "if output=$(LINURA_AUTHORITY_STATE_DIR=/dev/null/linura-authority-qualification /usr/local/bin/linura-authorityd 2>&1); then printf '%s\\n' 'authority daemon unexpectedly accepted invalid state directory' >&2; exit 1; fi; case \"$output\" in *'linura-authorityd failed closed:'*) printf '%s\\n' 'authority daemon rejected invalid state directory' ;; *) printf '%s\\n' \"$output\" >&2; exit 1 ;; esac"
    }
  ],
  "execution_status": "executable"
}
